quotes,source,https://quotes.values.com/quote_artwork/7604/medium/20160316_thursday_quote_fixed.jpg?1489676702
I can't think of any better representation of beauty than someone who is unafraid to be herself.,https://quotes.values.com/quote_artwork/7603/medium/20170315_wednesday_quote.jpg?1489185287
You're amazing just the way you are.,https://quotes.values.com/quote_artwork/7607/medium/20170314_tuesday_quote_alternate.jpg?1489340634
Beauty is being the best possible version of yourself.,https://quotes.values.com/quote_artwork/7606/medium/20170313_monday_quote_alternate.jpg?1489340528
"Too often we underestimate the power of a touch, a smile, a kind word... all of which have the potential to turn a life around.",https://quotes.values.com/quote_artwork/7323/medium/20170310_friday_quote_alternate.jpg?1488588869
"Today, give yourself permission to be outrageously kind, irrationally warm, improbably generous. I promise it will be a blast.",https://quotes.values.com/quote_artwork/7601/medium/20170309_thursday_quote_updated.jpg?1489074550
"Unless someone like you cares a whole awful lot, nothing is going to get better. It's not.",https://quotes.values.com/quote_artwork/3505/medium/20170308_wednesday_quote.jpg?1488581688
You really can change the world if you care enough.,https://quotes.values.com/quote_artwork/7600/medium/20170307_tuesday_quote_alternate_alternate.jpg?1488768736
The simple act of caring is heroic.,https://quotes.values.com/quote_artwork/7599/medium/20170306_monday_quote.jpg?1488581604
A smile is the universal welcome.,https://quotes.values.com/quote_artwork/5014/medium/20170303_friday_quote.jpg?1487971104
"A gentle word, a kind look, a good-natured smile can work wonders and accomplish miracles.",https://quotes.values.com/quote_artwork/7598/medium/20170302_thursday_quote.jpg?1487971046
Everyone smiles in the same language.,https://quotes.values.com/quote_artwork/7596/medium/20170227_monday_quote_alternate.jpg?1487976249
"Every time you smile at someone, it is an action of love, a gift to that person, a beautiful thing.",https://quotes.values.com/quote_artwork/7597/medium/20170228_tuesday_quote.jpg?1487970916
A smile is a curve that sets everything straight.,https://quotes.values.com/quote_artwork/6258/medium/20170301_wednesday_quote.jpg?1487970967
A laugh is a smile that bursts.,https://quotes.values.com/quote_artwork/4477/medium/20170223_thursday_quote.jpg?1487357795
"I have seen what a laugh can do. It can transform almost unbearable tears into something bearable, even hopeful.",https://quotes.values.com/quote_artwork/5063/medium/20170222_wednesday_quote.jpg?1487357672
Laughter is the fireworks of the soul.,https://quotes.values.com/quote_artwork/6607/medium/20170221_tuesday_quote.jpg?1487357637
To thrive in life you need three bones. A wishbone. A backbone. And a funny bone.,https://quotes.values.com/quote_artwork/6829/medium/20170220_monday_quote.jpg?1487357607
"When we feel love and kindness toward others, it not only makes others feel loved and cared for, but it helps us also to develop inner happiness and peace.",https://quotes.values.com/quote_artwork/4974/medium/20170217_friday_quote_alternate2.jpg?1486774023
"Love is the the most radically subversive activism of all, the only thing that ever changed anyone.",https://quotes.values.com/quote_artwork/7592/medium/20170216_thursday_quote.jpg?1486756735
All you need is love.,https://quotes.values.com/quote_artwork/7591/medium/20170214_tuesday_quote_alternate.jpg?1486770929
,https://quotes.values.com/quote_artwork/6143/medium/20170215_wednesday_quote_fixed.jpg?1486757345
Occasionally in life there are those moments of unutterable fulfillment which cannot be completely explained by those symbols called words. Their meanings can only be articulated by the inaudible language of the heart.,https://quotes.values.com/quote_artwork/5242/medium/20170210_friday_quote.jpg?1486062988
What counts can’t always be counted; what can be counted doesn’t always count.,https://quotes.values.com/quote_artwork/6794/medium/20170206_monday_quote.jpg?1486062644
"Normal day, let me be aware of the treasure you are. Let me learn from you, love you, bless you before you depart. Let me not pass you by in the quest of some rare and perfect tomorrow.",https://quotes.values.com/quote_artwork/6181/medium/20170208_wednesday_quote.jpg?1486062806
Enjoy all you have while pursuing all you want.,https://quotes.values.com/quote_artwork/6286/medium/20170207_tuesday_quote.jpg?1486062755
We can only be said to be alive in those moments when our hearts are conscious of our treasures.,https://quotes.values.com/quote_artwork/4224/medium/20170209_thursday_quote.jpg?1486062929
"The molecules of your body are the same molecules that make up the nebulae, that burn inside the stars themselves. We are star stuff.",https://quotes.values.com/quote_artwork/6104/medium/20170203_friday_quote.jpg?1485562899
"What I admire in Columbus is not his having discovered a world, but his having gone to search for it on the faith of his own opinion.",https://quotes.values.com/quote_artwork/6133/medium/20170202_thursday_quote.jpg?1485562850
"Create the highest, grandest vision possible for your life, because you become what you believe.",https://quotes.values.com/quote_artwork/7349/medium/20170201_wednesday_quote_alternate.jpg?1485747615
"Aerodynamically, the bumble bee shouldn't be able to fly, but the bumble bee doesn't know it so it goes on flying anyway.",https://quotes.values.com/quote_artwork/5067/medium/20170131_tuesday_quote.jpg?1485562783
Working hard is important. But there is something that matters even more: believing in yourself.,https://quotes.values.com/quote_artwork/7589/medium/20170130_monday_quote.jpg?1485562758
Things turn out best for the people who make the best of the way things turn out.,https://quotes.values.com/quote_artwork/6606/medium/20170127_friday_quote.jpg?1485042374
"I have missed more than 9,000 shots in my career. I have lost almost 300 games. On 26 occasions I have been entrusted to take the game winning shot...and I missed. I have failed over and over and over again in my life. And that's precisely why I succeed.",https://quotes.values.com/quote_artwork/6568/medium/20170126_thursday_quote.jpg?1485042256
Your present circumstances don’t determine where you can go; they merely determine where you start.,https://quotes.values.com/quote_artwork/6858/medium/20170125_wednesday_quote.jpg?1485042129
You must do the thing which you think you cannot do.,https://quotes.values.com/quote_artwork/7588/medium/20170124_tuesday_quote_alternate.jpg?1485132145
Motivation is when your dreams put on work clothes.,https://quotes.values.com/quote_artwork/6240/medium/20170123_monday_quote.jpg?1485042008
"There is no chance, no destiny, no fate, that can hinder or control the firm resolve of a determined soul.",https://quotes.values.com/quote_artwork/4218/medium/20170120_friday_quote.jpg?1484335964
There are no shortcuts to any place worth going.,https://quotes.values.com/quote_artwork/4076/medium/20170119_thursday_quote.jpg?1484335891
The person who makes a success of living is the one who sees his goal steadily and aims for it unswervingly. That is dedication.,https://quotes.values.com/quote_artwork/6440/medium/20170118_wednesday_quote.jpg?1484335757
He who would learn to fly one day must first learn to stand and walk and run and climb and dance; one cannot fly into flying.,https://quotes.values.com/quote_artwork/5886/medium/20170117_tuesday_quote.jpg?1484335634
Dreams and dedication are a powerful combination.,https://quotes.values.com/quote_artwork/3763/medium/20170116_monday_quote.jpg?1484335594
Trust yourself. Create the kind of self that you will be happy to live with all your life.,https://quotes.values.com/quote_artwork/5513/medium/20170113_friday_quote_shorter.jpg?1483835475
"Each time we face our fear, we gain strength, courage and confidence in the doing.",https://quotes.values.com/quote_artwork/7587/medium/20170112_thursday_quote_alternate.jpg?1483835639
"Be who you are and say what you feel, because in the end those who matter don't mind and those who mind don't matter.",https://quotes.values.com/quote_artwork/3506/medium/20170111_wednesday_quote.jpg?1483827811
"Confidence comes not from always being right, but from not fearing to be wrong.",https://quotes.values.com/quote_artwork/6508/medium/20170110_tuesday_quote.jpg?1483827774
Every small positive change we make in ourselves repays us in confidence in the future.,https://quotes.values.com/quote_artwork/6990/medium/20170109_monday_quote.jpg?1483827700
You may have to fight a battle more than once to win it.,https://quotes.values.com/quote_artwork/4400/medium/20170106_friday_quote.jpg?1483140248
"Great changes may not happen right away, but with effort even the difficult may become easy.",https://quotes.values.com/quote_artwork/3124/medium/20170105_thursday_quote.jpg?1483140205
"Stay committed to your decisions, but stay flexible in your approach.",https://quotes.values.com/quote_artwork/3971/medium/20170104_wednesday_quote.jpg?1483140153
"Commitment unlocks the doors of imagination, allows vision, and gives us the right stuff to turn our dream into reality.",https://quotes.values.com/quote_artwork/4245/medium/20170103_tuesday_quote.jpg?1483140096
"Once a man has made a commitment to a way of life, he puts the greatest strength in the world behind him. It's something we call heart power. Once a man has made this commitment, nothing will stop him short of success.",https://quotes.values.com/quote_artwork/3750/medium/20170102_monday_quote.jpg?1483140044
"We are only as strong as we are united, as weak as we are divided.",https://quotes.values.com/quote_artwork/7537/medium/20161230_friday_quote_alternate2.jpg?1482626247
"Individually, we are one drop. Together, we are an ocean.",https://quotes.values.com/quote_artwork/7585/medium/20161229_thursday_quote.jpg?1482437442
Wisdom is knowing we are all One. Love is what it feels like and compassion is what it acts like.,https://quotes.values.com/quote_artwork/7584/medium/20161228_wednesday_quote.jpg?1482436773
Alone we can do so little; together we can do so much.,https://quotes.values.com/quote_artwork/3666/medium/20161227_tuesday_quote.jpg?1482436726
The essence of the beautiful is unity in variety.,https://quotes.values.com/quote_artwork/7586/medium/20161226_monday_quote_alternate2.jpg?1482626189
Peace begins with a smile.,https://quotes.values.com/quote_artwork/7583/medium/20161223_friday_quote.jpg?1481917022
It isn’t enough to talk about peace. One must believe in it. And it isn’t enough to believe in it. One must work at it.,https://quotes.values.com/quote_artwork/7582/medium/20161222_thursday_quote.jpg?1481916990
"We plant seeds that will flower as results in our lives, so best to remove the weeds of anger, avarice, envy and doubt, that peace and abundance may manifest for all.",https://quotes.values.com/quote_artwork/6484/medium/20161221_wednesday_quote.jpg?1481916952
Choose love and peace will follow. Choose peace and love will follow.,https://quotes.values.com/quote_artwork/3328/medium/20161220_tuesday_quote.jpg?1481916916
"When we have peace in our hearts and minds, we draw peace into our lives.",https://quotes.values.com/quote_artwork/6962/medium/20161219_monday_quote.jpg?1481916885
Infuse your life with action. Don't wait for it to happen. Make it happen. Make your own future. Make your own hope.,https://quotes.values.com/quote_artwork/6731/medium/20161215_thursday_quote_new.jpg?1481508656
"Let your hopes, not your hurts, shape your future.",https://quotes.values.com/quote_artwork/7580/medium/20161214_wednesday_quote_new.jpg?1481508577
"A good teacher can inspire hope, ignite the imagination, and instill a love of learning.",https://quotes.values.com/quote_artwork/7579/medium/20161213_tuesday_quote_new.jpg?1481508135
Optimism is the faith that leads to achievement.,https://quotes.values.com/quote_artwork/3661/medium/20161212_monday_quote_new.jpg?1481507948
"Always reward your long hours of labor surrounded by your family. Nurture their love carefully, remembering that your children need models, not critics. And even if you have failed at all else in the eyes of the world, if you have a loving family, you are a success.",https://quotes.values.com/quote_artwork/7181/medium/20161209_friday_quote.jpg?1480704153
Family is not an important thing. It's everything.,https://quotes.values.com/quote_artwork/7573/medium/20161208_thursday_quote_alternate.jpg?1480887451
"The only rock I know that stays steady, the only institution I know that works, is the family.",https://quotes.values.com/quote_artwork/7578/medium/20161207_wednesday_quote_alternate.jpg?1480887471
A happy family is but an earlier heaven.,https://quotes.values.com/quote_artwork/7577/medium/20161206_tuesday_quote_alternate.jpg?1480886770
The family is one of nature's masterpieces.,https://quotes.values.com/quote_artwork/7576/medium/20161205_monday_quote_alternate.jpg?1480886611
"…find out where joy resides, and give it a voice far beyond singing. For to miss the joy is to miss all.",https://quotes.values.com/quote_artwork/7572/medium/20161202_friday_quote_fixed.jpg?1480104427
"Watch the sunrise at least once a year, put a lot of marshmallows in your hot chocolate, lie on your back and look at the stars, never buy a coffee table you can't put your feet on, never pass up a chance to jump on a trampoline, don't overlook life's small joys while searching for the big ones.",https://quotes.values.com/quote_artwork/6855/medium/20161201_thursday_quote.jpg?1480104317
"Happiness, not in another place, but this place not for another hour, but for this hour.",https://quotes.values.com/quote_artwork/7571/medium/20161130_wednesday_quote.jpg?1480104279
"I’m beginning to recognize that real happiness isn’t something large and looming on the horizon ahead, but something small, numerous and already here. The smile of someone you love. A decent breakfast. The warm sunset. Your little everyday joys all lined up in a row.",https://quotes.values.com/quote_artwork/7570/medium/20161129_tuesday_quote.jpg?1480104252
The joy we feel has little to do with the circumstances of our lives and everything to do with the focus of our lives.,https://quotes.values.com/quote_artwork/7569/medium/20161128_monday_quote.jpg?1480104206
The struggle ends when gratitude begins.,https://quotes.values.com/quote_artwork/7568/medium/20161125_friday_quote.jpg?1479511890
Two kinds of gratitude: the sudden kind we feel for what we take; the larger kind we feel for what we give.,https://quotes.values.com/quote_artwork/7567/medium/20161124_thursday_quote.jpg?1479511840
Invite your heart to be grateful and your thank yous will be heard even when you don't use words.,https://quotes.values.com/quote_artwork/5090/medium/yous.jpg?1480350589
"We should certainly count our blessings, but we should also make our blessings count.",https://quotes.values.com/quote_artwork/7566/medium/20161122_tuesday_quote.jpg?1479511746
"Gratitude unlocks the fullness of life. It turns what we have into enough, and more.",https://quotes.values.com/quote_artwork/3105/medium/20161121_monday_quote_shorter.jpg?1479511707
"A pessimist, they say, sees a glass as being half empty; an optimist sees the same glass as half full. But a giving person sees a glass of water and starts looking for someone who might be thirsty.",https://quotes.values.com/quote_artwork/3485/medium/20161118_friday_quote.jpg?1478909885
"Infinitely more important than sharing one's material wealth is sharing the wealth of ourselves—our time and energy, our passion and commitment, and, above all, our love.",https://quotes.values.com/quote_artwork/5357/medium/20161117_thursday_quote.jpg?1478909854
"The best thing to give to your enemy is forgiveness; to an opponent, tolerance; to a friend, your heart; to your child, a good example; to a father, deference; to your mother, conduct that will make her proud of you; to yourself, respect; to all men, charity.",https://quotes.values.com/quote_artwork/5407/medium/20161116_wednesday_quote.jpg?1478909818
"The way you get meaning into your life is to devote yourself to loving others, devote yourself to your community around you, and devote yourself to creating something that gives you purpose and meaning.",https://quotes.values.com/quote_artwork/5915/medium/20161114_monday_quote.jpg?1478909744
"Hope lies in dreams, in imagination and in the courage of those who dare to make dreams into reality.",https://quotes.values.com/quote_artwork/6941/medium/20161111_friday_quote.jpg?1478299601
"They say a person needs just three things to be truly happy in this world: someone to love, something to do, and something to hope for.",https://quotes.values.com/quote_artwork/7564/medium/20161110_thursday_quote.jpg?1478298897
"It's really a wonder that I haven't dropped all my ideals, because they seem so absurd and impossible to carry out. Yet I keep them, because in spite of everything, I still believe that people are really good at heart.",https://quotes.values.com/quote_artwork/7562/medium/20161109_wednesday_quote.jpg?1478298699
"You may say I'm a dreamer, but I'm not the only one. I hope someday you'll join us. And the world will live as one.",https://quotes.values.com/quote_artwork/7460/medium/20161108_tuesday_quote.jpg?1478299674
"Learn from yesterday, live for today, hope for tomorrow. The important thing is not to stop questioning.",https://quotes.values.com/quote_artwork/7563/medium/20161107_monday_quote.jpg?1478297151
We all live with the objective of being happy; our lives are all different and yet the same.,https://quotes.values.com/quote_artwork/3463/medium/20161104_friday_quote.jpg?1477687195
"If you don't know the guy on the other side of the world, love him anyway because he's just like you. He has the same dreams, the same hopes and fears. It's one world, pal. We're all neighbors.",https://quotes.values.com/quote_artwork/6974/medium/20161103_thursday_quote.jpg?1477687139
"Touch the earth, speak of love, walk on common ground.",https://quotes.values.com/quote_artwork/7560/medium/20161102_wednesday_quote.jpg?1477687072
Our similarities bring us to a common ground; our differences allow us to be fascinated by each other.,https://quotes.values.com/quote_artwork/4406/medium/20161101_tuesday_quote.jpg?1477687017
"Humankind has not woven the web of life. We are but one thread within it. Whatever we do to the web, we do to ourselves. All things are bound together. All things connect.",https://quotes.values.com/quote_artwork/4909/medium/20161031_monday_quote.jpg?1477686952
"We don't need to share the same opinions as others, but we need to be respectful.",https://quotes.values.com/quote_artwork/3239/medium/20161028_friday_quote_alternate.jpg?1477084371
"In recognizing the humanity of our fellow beings, we pay ourselves the highest tribute.",https://quotes.values.com/quote_artwork/4404/medium/20161027_thursday_quote.jpg?1477073084
The capacity for getting along with our neighbor depends to a large extent on the capacity for getting along with ourselves. The self-respecting individual will try to be as tolerant of his neighbor's shortcomings as he is of his own.,https://quotes.values.com/quote_artwork/4570/medium/20161026_wednesday_quote.jpg?1477073033
Respect is love in action.,https://quotes.values.com/quote_artwork/7559/medium/20161025_tuesday_quote.jpg?1477072984
"If a man does not keep pace with his companions, perhaps it is because he hears a different drummer. Let him step to the music which he hears, however measured or far away.",https://quotes.values.com/quote_artwork/6149/medium/20161024_monday_quote.jpg?1477072928
Hardships often prepare ordinary people for an extraordinary destiny.,https://quotes.values.com/quote_artwork/6940/medium/20161021_friday_quote.jpg?1476493695
"No soul that aspires can ever fail to rise; no heart that loves can ever be abandoned. Difficulties exist only that in overcoming them we may grow strong, and they who have suffered are able to save.",https://quotes.values.com/quote_artwork/6739/medium/20161020_thursday_quote.jpg?1476493663
Rock bottom became the solid foundation on which I rebuilt my life.,https://quotes.values.com/quote_artwork/6595/medium/20161019_wednesday_quote.jpg?1476493628
"Although the world is full of suffering, it's full also of the overcoming it.",https://quotes.values.com/quote_artwork/3663/medium/20161018_tuesday_quote_alternate.jpg?1476589660
"When we face the worst that can happen in any situation, we grow. When circumstances are at their worst, we can find our best.",https://quotes.values.com/quote_artwork/6200/medium/20161017_monday_quote.jpg?1476493467
"A good character is the best tombstone. Those who loved you, and were helped by you, will remember you when forget-me-nots have withered. Carve your name on hearts, not on marble.",https://quotes.values.com/quote_artwork/6978/medium/20161014_friday_quote_fixed.jpg?1475862397
You express the truth of your character with the choice of your actions.,https://quotes.values.com/quote_artwork/7558/medium/20161013_thursday_quote.jpg?1475862293
Character consists of what you do on the third and fourth tries.,https://quotes.values.com/quote_artwork/3819/medium/20161012_wednesday_quote_alternate.jpg?1476048608
"Character, the willingness to accept responsibility for one's own life, is the source from which self-respect springs.",https://quotes.values.com/quote_artwork/3315/medium/20161011_tuesday_quote_alternate.jpg?1476048547
Thoughts lead on to purposes; purposes go forth in action; actions form habits; habits decide character; and character fixes our destiny.,https://quotes.values.com/quote_artwork/4921/medium/20161010_monday_quote_alternate.jpg?1476048488
One must care about a world one will not see.,https://quotes.values.com/quote_artwork/6135/medium/20161007_friday_quote.jpg?1475254118
"If you want to make a difference and leave your world a better place, let others know how important they are as you put their needs above yours.",https://quotes.values.com/quote_artwork/3283/medium/20161006_thursday_quote_alternate.jpg?1475260602
"Caring about the happiness of others, we find our own.",https://quotes.values.com/quote_artwork/7557/medium/20161004_tuesday_quote.jpg?1475253974
For every beauty there is an eye somewhere to see it. For every truth there is an ear somewhere to hear it. For every love there is a heart somewhere to receive it.,https://quotes.values.com/quote_artwork/6201/medium/20161003_monday_quote.jpg?1475253932
You don’t inspire your teammates by showing them how amazing you are. You inspire them by showing them how amazing they are.,https://quotes.values.com/quote_artwork/7556/medium/20160930_friday_quote_alternate.jpg?1474670723
"The mark of great sportsmen is not how good they are at their best, but how good they are at their worst.",https://quotes.values.com/quote_artwork/7555/medium/20160929_thursday_quote.jpg?1474659415
Do you know what my favorite part of the game is? The opportunity to play.,https://quotes.values.com/quote_artwork/7554/medium/20160928_wednesday_quote_alternate.jpg?1474670698
"If character is what you do when no one is watching, then sportsmanship is that conduct with everybody watching.",https://quotes.values.com/quote_artwork/7553/medium/20160927_tuesday_quote.jpg?1474659014
One man practicing sportsmanship is far better than a hundred teaching it.,https://quotes.values.com/quote_artwork/7552/medium/20160926_monday_quote_alternate2.jpg?1474670673
"Enjoy the little things, for one day you may look back and realize they were the big things.",https://quotes.values.com/quote_artwork/6601/medium/20160923_friday_quote.jpg?1474051442
Sometimes you will never know the value of a moment until it becomes a memory.,https://quotes.values.com/quote_artwork/6639/medium/20160922_thursday_quote.jpg?1474051377
Appreciation is a wonderful thing. It makes what is excellent in others belong to us as well.,https://quotes.values.com/quote_artwork/4298/medium/20160920_tuesday_quote.jpg?1474051296
"Forget yesterday - it has already forgotten you. Don't sweat tomorrow - you haven't even met. Instead, open your eyes and your heart to a truly precious gift - today.",https://quotes.values.com/quote_artwork/7551/medium/20160919_monday_quote.jpg?1474051254
Your body is the harp of your soul and it is yours to bring forth sweet music from it or confused sounds.,https://quotes.values.com/quote_artwork/7550/medium/20160916_friday_quote.jpg?1473457721
"I don't dwell on my age. It might limit what I can do. As long as I have my mind and health, it's just a number.",https://quotes.values.com/quote_artwork/6046/medium/20160915_thursday_quote_alternate.jpg?1473703166
"Early to bed and early to rise makes a man healthy, wealthy and wise.",https://quotes.values.com/quote_artwork/7549/medium/20160914_wednesday_quote.jpg?1473457640
Health and cheerfulness naturally beget each other.,https://quotes.values.com/quote_artwork/7548/medium/20160913_tuesday_quote.jpg?1473457600
"Eat healthily, sleep well, breathe deeply, move harmoniously.",https://quotes.values.com/quote_artwork/7547/medium/20160912_monday_quote.jpg?1473457565
"Ask not for an easy life...ask for the strength to face the elements, to weather the storms; to be the might for the right and the weak, to be the voice for those who cannot speak, to see one's dreams to fruition with dignity, integrity, and grace.",https://quotes.values.com/quote_artwork/3842/medium/20160909_friday_quote.jpg?1472836624
Storms make trees take deeper roots.,https://quotes.values.com/quote_artwork/6681/medium/20160908_thursday_quote.jpg?1472836572
