quotes,source"You're only responsible for being honest, not for someone else's reaction to your honesty.",https://quotes.values.com/quote_artwork/7371/medium/thursday_quote.jpg?1441570772
"Three things cannot be long hidden: the sun, the moon, and the truth.",https://quotes.values.com/quote_artwork/7370/medium/wednesday_quote.jpg?1441570733
"We have to stand up for what we believe in, even when we might not be popular for it. Honesty starts with being ourselves, authentic and true to who we are and what we believe in, and that may not always be popular, but it will always let you follow your dreams and your heart.",https://quotes.values.com/quote_artwork/7369/medium/tuesday_quote.jpg?1441570684
"Honesty is more than not lying. It is truth telling, truth speaking, truth living, and truth loving.",https://quotes.values.com/quote_artwork/7368/medium/monday_quote.jpg?1441570627
Our character is what we do when we think no one is looking.,https://quotes.values.com/quote_artwork/7367/medium/friday_quote.jpg?1440797735
"Character may be manifested in the great moments, but it is made in the small ones.",https://quotes.values.com/quote_artwork/7366/medium/thursday_quote.jpg?1440797667
Strength of a character isn't always about how much you can handle before you break. It’s also about how much you can handle after you've been broken.,https://quotes.values.com/quote_artwork/7365/medium/wednesday_quote.jpg?1440797621
"Good character is more to be praised than outstanding talent. Most talents are to some extent a gift. Good character, by contrast, is not given to us. We have to build it piece by piece by thought, choice, courage and determination.",https://quotes.values.com/quote_artwork/7364/medium/tuesday_quote.jpg?1440797531
"Character cannot be developed in ease and quiet. Only through experience of trial and suffering can the soul be strengthened, vision cleared, ambition inspired, and success achieved.",https://quotes.values.com/quote_artwork/7363/medium/monday_quote.jpg?1440797466
"All that is gold does not glitter, not all those who wander are lost; The old that is strong does not wither, deep roots are not reached by the frost.",https://quotes.values.com/quote_artwork/7362/medium/friday_quote.jpg?1440344978
"Then, one day, when you least expect it, the great adventure finds you.",https://quotes.values.com/quote_artwork/7361/medium/thursday_quote.jpg?1440344895
"Maybe the journey isn’t so much about becoming anything. Maybe it’s about un-becoming everything that isn’t really you, so you can be who you were meant to be in the first place.",https://quotes.values.com/quote_artwork/7360/medium/wednesday_quote.jpg?1440344830
"Be like the bird that, passing on her flight awhile on boughs too slight, feels them give way beneath her, and yet sings, knowing that she hath wings.",https://quotes.values.com/quote_artwork/7358/medium/monday_quote.jpg?1440344643
I've always found that anything worth achieving will always have obstacles in the way and you've got to have that drive and determination to overcome those obstacles on route to whatever it is that you want to accomplish.,https://quotes.values.com/quote_artwork/7357/medium/friday_quote.jpg?1439757339
Without ambition one starts nothing. Without work one finishes nothing. The prize will not be sent to you. You have to win it.,https://quotes.values.com/quote_artwork/7356/medium/thursday_quote.jpg?1439757299
"It's faith that will take you through, and determination that will drive you.",https://quotes.values.com/quote_artwork/7355/medium/wednesday_quote.jpg?1439757259
Never look down to test the ground before taking your next step; only he who keeps his eye fixed on the far horizon will find the right road.,https://quotes.values.com/quote_artwork/7354/medium/tuesday_quote.jpg?1439757221
"Don't ever give up. Don't ever give in. Don't ever stop trying. Don't ever sell out. And if you find yourself succumbing to one of the above for a brief moment, pick yourself up, brush yourself off, whisper a prayer, and start where you left off. But never, ever, ever give up.",https://quotes.values.com/quote_artwork/7353/medium/monday_quote.jpg?1439757169
The real voyage of discovery consists of not in seeking new landscapes but in having new eyes.,https://quotes.values.com/quote_artwork/7352/medium/friday_quote.jpg?1439166389
"Your vision will become clear only when you look into your heart. Who looks outside, dreams. Who looks inside awakens.",https://quotes.values.com/quote_artwork/7351/medium/thursday_quote.jpg?1439166069
The only thing worse than being blind is having sight and no vision.,https://quotes.values.com/quote_artwork/7350/medium/wednesday_quote.jpg?1439165886
The problems of the world cannot possibly be solved by skeptics or cynics whose horizons are limited by the obvious realities.,https://quotes.values.com/quote_artwork/7348/medium/monday_quote.jpg?1439165376
"There are painters who transform the sun to a yellow spot, but there are others who with the help of their art and their intelligence, transform a yellow spot into sun.",https://quotes.values.com/quote_artwork/7347/medium/friday_quote.jpg?1438374380
"You can't use up creativity. The more you use, the more you have.",https://quotes.values.com/quote_artwork/7346/medium/thursday_quote.jpg?1438374079
Creativity is allowing yourself to make mistakes. Art is knowing which ones to keep.,https://quotes.values.com/quote_artwork/7345/medium/wednesday_quote.jpg?1438373869
Logic will get you from A to B. Imagination will take you everywhere.,https://quotes.values.com/quote_artwork/7344/medium/tuesday_quote.jpg?1438373583
"To live a creative life, we must lose our fear of being wrong.",https://quotes.values.com/quote_artwork/7343/medium/monday_quote.jpg?1438373336
"While some may see them as the crazy ones, we see genius. Because the people who are crazy enough to think they can change the world, are the ones who do.",https://quotes.values.com/quote_artwork/7342/medium/friday_quote.jpg?1437763060
Life begins at the end of your comfort zone.,https://quotes.values.com/quote_artwork/7341/medium/thursday_quote.jpg?1437762398
"Walk with the dreamers, the believers, the courageous, the cheerful, the planners, the doers, the successful people with their heads in the clouds and their feet on the ground. Let their spirit ignite a fire within you to leave this world better than when you found it.",https://quotes.values.com/quote_artwork/7340/medium/wednesday_quote.jpg?1437762183
"Your journey has molded you for the greater good, and it was exactly what it needed to be. Don't think that you've lost time. It took each and every situation you have encountered to bring you to the now. And now is right on time.",https://quotes.values.com/quote_artwork/7339/medium/tuesday_quote.jpg?1437761903
"Do the things you used to talk about doing but never did. Know when to let go and when to hold on tight. Stop rushing. Don't be intimidated to say it like it is. Stop apologizing all the time. Learn to say no, so your yes has some oomph. Spend time with the friends who lift you up, and cut loose the ones who bring you down. Stop giving your power away. Be more concerned with being interested than being interesting. Be old enough to appreciate your freedom, and young enough to enjoy it. Finally, know who you are.",https://quotes.values.com/quote_artwork/7338/medium/monday_quote.jpg?1437760794
"It's easy to find reasons for division between people. Finding common ground is harder, but a step towards happiness.",https://quotes.values.com/quote_artwork/7336/medium/thursday_quote.jpg?1437165594
"We find greatest joy, not in getting, but in expressing what we are. Men do not really live for honors or for pay; their gladness is not the taking and holding, but in doing, the striving, the building, the living. It is a higher joy to teach than to be taught. It is good to get justice, but better to do it; fun to have things but more to make them. The happy man is he who lives the life of love, not for the honors it may bring, but for the life itself.",https://quotes.values.com/quote_artwork/7332/medium/friday_quote.jpg?1436492928
Joy goes against the foundations of mathematics: it multiplies when we divide.,https://quotes.values.com/quote_artwork/7331/medium/thursday_quote.jpg?1436492870
Comparison is the thief of joy.,https://quotes.values.com/quote_artwork/7330/medium/wednesday_quote.jpg?1436492808
Joy is what happens to us when we allow ourselves to recognize how good things really are.,https://quotes.values.com/quote_artwork/7328/medium/monday_quote.jpg?1436492692
"Learn to love without condition. Talk without bad intention. Give without any reason. And most of all, care for people without any expectation.",https://quotes.values.com/quote_artwork/7327/medium/friday_quote_alternate.jpg?1436376972
"If you shift your focus from yourself to others, extend your concern to others, and cultivate the thought of caring for the well being of others, then this will have the immediate effect of opening up your life and helping you to reach out.",https://quotes.values.com/quote_artwork/7326/medium/thursday_quote.jpg?1435956862
Sometimes its not the strength but gentleness that cracks the hardest shells.,https://quotes.values.com/quote_artwork/7325/medium/wednesday_quote.jpg?1435956815
"Excellence is the result of caring more than others think is wise, risking more than others think is safe, dreaming more than others think is practical, and expecting more than others think is possible.",https://quotes.values.com/quote_artwork/7324/medium/tuesday_quote.jpg?1435956757
"Desire is the key to motivation, but it’s determination and commitment to an unrelenting pursuit of your goal - a commitment to excellence - that will enable you to attain the success you seek.",https://quotes.values.com/quote_artwork/7322/medium/friday_quote.jpg?1435360106
"Without commitment, you cannot have depth in anything, whether it's a relationship, a business or a hobby.",https://quotes.values.com/quote_artwork/7321/medium/thursday_quote.jpg?1435360036
"There's a difference between interest and commitment. When you're interested in doing something, you do it only when it's convenient. When you're committed to something, you accept no excuses - only results.",https://quotes.values.com/quote_artwork/7320/medium/wednesday_quote.jpg?1435359983
"Freedom is not the absence of commitments, but the ability to choose - and commit myself to - what is best for me.",https://quotes.values.com/quote_artwork/7319/medium/tuesday_quote.jpg?1435359929
There are only two options regarding commitment. You're either in or you're out. There's no such thing as life in-between.,https://quotes.values.com/quote_artwork/7318/medium/monday_quote.jpg?1435359870
"If I had to select one quality, one personal characteristic that I regard as being most highly correlated with success, whatever the field, I would pick the trait of persistence. Determination.",https://quotes.values.com/quote_artwork/7317/medium/friday_quote.jpg?1434745386
"Your opponent, in the end, is never really the player on the other side of the net, or the swimmer in the next lane, or the team on the other side of the field, or even the bar you must high-jump. Your opponent is yourself, your negative internal voices, your level of determination.",https://quotes.values.com/quote_artwork/7316/medium/thursday_quote.jpg?1434745310
It had long since come to my attention that people of accomplishment rarely sat back and let things happen to them. They went out and happened to things.,https://quotes.values.com/quote_artwork/7315/medium/wednesday_quote.jpg?1434745252
"She stood in the storm, and when the wind did not blow her way, she adjusted her sails.",https://quotes.values.com/quote_artwork/7314/medium/tuesday_quote.jpg?1434745194
I believe success is achieved by ordinary people with extraordinary determination.,https://quotes.values.com/quote_artwork/7313/medium/monday_quote.jpg?1434745085
"Be of good cheer. Do not think of today's failures, but of the success that may come tomorrow. You have set yourselves a difficult task, but you will succeed if you persevere; and you will find a joy in overcoming obstacles. Remember, no effort that we make to attain something beautiful is ever lost.",https://quotes.values.com/quote_artwork/7312/medium/friday_quote.jpg?1434134969
"Change is not something that we should fear. Rather, it is something that we should welcome. For without change, nothing in this world would ever grow or blossom, and no one in this world would ever move forward to become the person they're meant to be.",https://quotes.values.com/quote_artwork/7311/medium/thursday_quote.jpg?1434134922
"Confront the dark parts of yourself, and work to banish them with illumination and forgiveness. Your willingness to wrestle with your demons will cause your angels to sing.",https://quotes.values.com/quote_artwork/7310/medium/wednesday_quote.jpg?1434134879
"The most beautiful people we have known are those who have known defeat, known suffering, known struggle, known loss, and have found their way out of the depths. These persons have an appreciation, a sensitivity, and an understanding of life that fills them with compassion, gentleness, and a deep loving concern. Beautiful people do not just happen.",https://quotes.values.com/quote_artwork/7309/medium/tuesday_quote.jpg?1434134837
"People are always blaming their circumstances for what they are. I don't believe in circumstances. The people who get on in this world are the people who get up and look for the circumstances they want, and if they can't find them, make them.",https://quotes.values.com/quote_artwork/7308/medium/monday_quote.jpg?1434134787
He who has a why to live for can bear almost any how.,https://quotes.values.com/quote_artwork/7307/medium/friday_quote.jpg?1433530742
"We don't beat the Grim Reaper by living longer, we beat the Reaper by living well and living fully, for the Reaper will come for all of us. The question is what do we do between the time we are born and the time he shows up.",https://quotes.values.com/quote_artwork/7306/medium/thursday_quote.jpg?1433530650
"That thing that you do, after your day job, in your free time, too early in the morning, too late at night. That thing you read about, write about, think about, in fact fantasize about. That thing you do when you’re all alone and there’s no one to impress, nothing to prove, no money to be made, simply a passion to pursue. That’s it. That’s your thing. That’s your heart, your guide. That’s the thing you must, must do.",https://quotes.values.com/quote_artwork/7305/medium/wednesday_quote.jpg?1433530572
The two most important days in your life are the day you are born and the day you find out why.,https://quotes.values.com/quote_artwork/7304/medium/tuesday_quote.jpg?1433530509
"The purpose of life is not to be happy. It is to be useful, to be honorable, to be compassionate, to have it make some difference that you have lived and lived well.",https://quotes.values.com/quote_artwork/7303/medium/monday_quote.jpg?1433530408
Courage is what it takes to stand up and speak; courage is also what it takes to sit down and listen.,https://quotes.values.com/quote_artwork/7302/medium/friday_quote.jpg?1432929626
"A ship is safe in harbor, but that's not what ships are for.",https://quotes.values.com/quote_artwork/7301/medium/thursday_quote.jpg?1432929576
Courage doesn't always roar. Sometimes courage is the little voice at the end of the day that says I'll try again tomorrow.,https://quotes.values.com/quote_artwork/7300/medium/wednesday_quote.jpg?1432929516
Life shrinks or expands in proportion to one's courage.,https://quotes.values.com/quote_artwork/7299/medium/tuesday_quote.jpg?1432929455
"You gain strength, courage and confidence by every experience in which you really stop to look fear in the face. You are able to say to yourself, 'I have lived through this horror. I can take the next thing that comes along.' You must do the thing you think you cannot do.",https://quotes.values.com/quote_artwork/7298/medium/monday_quote.jpg?1432929390
It takes two flints to make a fire.,https://quotes.values.com/quote_artwork/7296/medium/thursday_quote.jpg?1432330204
The strength of the team is each individual member. The strength of each member is the team.,https://quotes.values.com/quote_artwork/7295/medium/wednesday_quote.jpg?1432330170
"If you want to go fast, go alone. If you want to go far, go together.",https://quotes.values.com/quote_artwork/7293/medium/monday_quote.jpg?1432330091
"Sportsmanship for me is when a guy walks off the court and you really can't tell whether he won or lost, when he carries himself with pride either way.",https://quotes.values.com/quote_artwork/7291/medium/thursday_quote.jpg?1431625624
"Be more concerned with your character than your reputation, because your character is what you really are, while your reputation is merely what others think you are.",https://quotes.values.com/quote_artwork/7290/medium/wednesday_quote.jpg?1431625527
"Games give you a chance to excel, and if you're playing in good company you don't even mind if you lose because you had the enjoyment of the company during the course of the game.",https://quotes.values.com/quote_artwork/7289/medium/tuesday_quote.jpg?1431625467
Victory is remembered for at most two decades; an act of good sportsmanship is remembered for a lifetime.,https://quotes.values.com/quote_artwork/7288/medium/monday_quote.jpg?1431625419
"I know you've heard it a thousand times before, but it's true... hard work pays off. If you want to be good, you have to practice, practice, practice. If you don't love something, then don't do it.",https://quotes.values.com/quote_artwork/7287/medium/friday_quote.jpg?1431039883
"To practice five things under all circumstances constitutes perfect virtue; these five are gravity, generosity of soul, sincerity, earnestness, and kindness.",https://quotes.values.com/quote_artwork/7286/medium/thursday_quote.jpg?1431039816
An ounce of practice is generally worth more than a ton of theory.,https://quotes.values.com/quote_artwork/7285/medium/wednesday_quote.jpg?1431039776
"It is a mistake to think that the practice of my art has become easy to me. I assure you, dear friend, no one has given so much care to the study of composition as I. There is scarcely a famous master in music whose works I have not frequently and diligently studied.",https://quotes.values.com/quote_artwork/7284/medium/tuesday_quote.jpg?1431039727
Practice isn't the thing you do once you're good. It's the thing you do that makes you good.,https://quotes.values.com/quote_artwork/7283/medium/monday_quote.jpg?1431039689
"Don't find the time to exercise, make the time to exercise.",https://quotes.values.com/quote_artwork/7282/medium/friday_quote.jpg?1430421267
"If it doesn’t challenge you, it doesn’t change you.",https://quotes.values.com/quote_artwork/7280/medium/wednesday_quote.jpg?1430421218
Take care of your body. It's the only place you have to live.,https://quotes.values.com/quote_artwork/7279/medium/tuesday_quote.jpg?1430421189
Health is the greatest of all possessions; a pale cobbler is better than a sick king.,https://quotes.values.com/quote_artwork/7278/medium/monday.jpg?1430421159
"A generous heart, kind speech, and a life of service and compassion are the things which renew humanity.",https://quotes.values.com/quote_artwork/7277/medium/friday.jpg?1430071906
I always wondered why somebody didn’t do something about that; then I realized that I am somebody.,https://quotes.values.com/quote_artwork/7275/medium/wednesday.jpg?1430071842
"The earth will not continue to offer its harvest, except with faithful stewardship. We cannot say we love the land and then take steps to destroy it for use by future generations.",https://quotes.values.com/quote_artwork/7273/medium/monday_pope.jpg?1429289952
The earth has music for those who listen.,https://quotes.values.com/quote_artwork/7271/medium/thursday.jpg?1429287464
Forget not that the earth delights to feel your bare feet and the winds long to play with your hair.,https://quotes.values.com/quote_artwork/7270/medium/wednesday.jpg?1429287424
"Climb the mountains and get their good tidings. Nature's peace will flow into you as sunshine flows into trees. The winds will blow their own freshness into you, and the storms their energy, while cares will drop away from you like the leaves of Autumn.",https://quotes.values.com/quote_artwork/7269/medium/tuesday.jpg?1429287388
"You must take personal responsibility. You cannot change the circumstances, the seasons, or the wind, but you can change yourself. That is something you have charge of.",https://quotes.values.com/quote_artwork/7267/medium/friday.jpg?1428686975
"Find joy in everything you choose to do. Every job, relationship, home... it's your responsibility to love it, or change it.",https://quotes.values.com/quote_artwork/7266/medium/thursday.jpg?1428686886
"The best day of your life is the one on which you decide your life is your own. No apologies or excuses. No one to lean on, rely on, or blame. The gift is yours - it is an amazing journey - and you alone are responsible for the quality of it. This is the day your life really begins.",https://quotes.values.com/quote_artwork/7265/medium/wednesday_new.jpg?1428939989
The final forming of a person's character lies in their own hands.,https://quotes.values.com/quote_artwork/7264/medium/tuesday.jpg?1428686784
"Accept responsibility for your life. Know that it is you who will get you where you want to go, no one else.",https://quotes.values.com/quote_artwork/7263/medium/monday.jpg?1428686734
"The wise do not buy into other people’s perceptions of who they are and what they are capable of. Instead, they bypass a person’s public persona and see who they are in their highest expression. When you see actions taken with integrity, instead of words only, you will then know a soul’s worth.",https://quotes.values.com/quote_artwork/7262/medium/friday.jpg?1428002997
"True beauty is not related to what color your hair is or what color your eyes are. True beauty is about who you are as a human being, your principles, your moral compass.",https://quotes.values.com/quote_artwork/7259/medium/tuesday.jpg?1428002763
The best and most beautiful things in the world cannot be seen or even touched - they must be felt with the heart.,https://quotes.values.com/quote_artwork/7258/medium/monday.jpg?1428002432
"Service is a smile.  It is an acknowledging wave, a reaching handshake, a friendly wink, and a warm hug.   It's these simple acts that matter most, because the greatest service to a human soul has always been the kindness of recognition.",https://quotes.values.com/quote_artwork/7257/medium/friday.jpg?1427494496
While we do our good works let us not forget that the real solution lies in a world in which charity will have become unnecessary.,https://quotes.values.com/quote_artwork/7255/medium/wednesday.jpg?1427494295
"We cannot seek achievement for ourselves and forget about progress and prosperity for our community...Our ambitions must be broad enough to include the aspirations and needs of others, for their sakes and for our own.",https://quotes.values.com/quote_artwork/7252/medium/friday.jpg?1426889135
"When we honestly ask ourselves which person in our lives means the most to us, we often find that it is those who, instead of giving advice, solutions, or cures, have chosen rather to share our pain and touch our wounds with a warm and tender hand.",https://quotes.values.com/quote_artwork/7250/medium/wednesday.jpg?1426889095
"When someone steals another's clothes, we call them a thief. Should we not give the same name to one who could clothe the naked and does not? The bread in your cupboard belongs to the hungry; the coat unused in your closet belongs to the one who needs it; the shoes rotting in your closet belong to the one who has no shoes; the money which you hoard up belongs to the poor.",https://quotes.values.com/quote_artwork/7249/medium/tuesday.jpg?1426889076
Love only grows by sharing. You can only have more for yourself by giving it away to others.,https://quotes.values.com/quote_artwork/7248/medium/monday.jpg?1426889057
"Go into the world and do well. But more importantly, go into the world and do good.",https://quotes.values.com/quote_artwork/7247/medium/friday.jpg?1425675625
"You cannot hope to build a better world without improving the individuals. To that end, each of us must work for our own improvement and, at the same time, share a general responsibility for all humanity, our particular duty being to aid those to whom we think we can be most useful.",https://quotes.values.com/quote_artwork/7246/medium/thursday.jpg?1425675509
"Never doubt that a small group of thoughtful, committed citizens can change the world; indeed, it’s the only thing that ever has.",https://quotes.values.com/quote_artwork/7245/medium/wednesday.jpg?1425675456
"I am only one, but I am one.  I cannot do everything, but I can do something.  And I will not let what I cannot do interfere with what I can do.",https://quotes.values.com/quote_artwork/7243/medium/monday.jpg?1425675370
"Gracious acceptance is an art—an art which most never bother to cultivate. We think that we have to learn how to give, but we forget about accepting things, which can be much harder than giving... Accepting another person's gift is allowing him to express his feelings for you.",https://quotes.values.com/quote_artwork/7242/medium/friday.jpg?1425671681
"The greatest good you can do for another is not just share your riches, but to reveal to him his own.",https://quotes.values.com/quote_artwork/7239/medium/tuesday.jpg?1425671500
