quotes,source
"Nothing is more noble, nothing more venerable, than loyalty.",https://quotes.values.com/quote_artwork/7898/medium/20190410_wednesday_quote.jpg?1554481638
Loyalty is the strongest glue—which makes a relationship last a lifetime.,https://quotes.values.com/quote_artwork/7901/medium/20190409_tuesday_quote_alternate.jpg?1554497336
You don’t earn loyalty in a day. You earn loyalty day-by-day.,https://quotes.values.com/quote_artwork/7896/medium/20190408_monday_quote.jpg?1554481590
"There may be people that have more talent than you, but there’s no excuse for anyone to work harder than you do.",https://quotes.values.com/quote_artwork/7895/medium/20190405_friday_quote.jpg?1553889173
"When you live for a strong purpose, hard work isn’t an option. It’s a necessity.",https://quotes.values.com/quote_artwork/7894/medium/20190404_thursday_quote.jpg?1553889149
Success isn't always about greatness. It's about consistency. Consistent hard work leads to success. Greatness will come.,https://quotes.values.com/quote_artwork/7893/medium/20190403_wednesday_quote.jpg?1553889106
"Successful people are not gifted; they just work hard, then succeed on purpose.",https://quotes.values.com/quote_artwork/7892/medium/20190402_tuesday_quote.jpg?1553889075
"I know the price of success: dedication, hard work, and an unremitting devotion to the things you want to see happen.",https://quotes.values.com/quote_artwork/6432/medium/20190401_monday_quote.jpg?1553888798
"Taking care of yourself doesn't mean me first, it means me too.",https://quotes.values.com/quote_artwork/7890/medium/20190329_friday_quote.jpg?1553276143
A kind word is like a spring day.,https://quotes.values.com/quote_artwork/7891/medium/20190328_thursday_quote_alternate.jpg?1553534100
"My mission in life is to be kind, compassionate, caring, and loving in order to find and feel the deepest joy of life.",https://quotes.values.com/quote_artwork/7888/medium/20190327_wednesday_quote.jpg?1553276090
I feel the capacity to care is the thing which gives life its deepest significance.,https://quotes.values.com/quote_artwork/3203/medium/20190326_tuesday_quote.jpg?1553276065
"Never believe that a few caring people can’t change the world. For, indeed, that’s all who ever have.",https://quotes.values.com/quote_artwork/7887/medium/20190325_monday_quote.jpg?1553276034
"Don’t be afraid to expand yourself, to step out of your comfort zone. That’s where the joy and the adventure lie.",https://quotes.values.com/quote_artwork/7886/medium/20190322_friday_quote.jpg?1552683104
At times you have to leave the city of your comfort and go into the wilderness of your intuition. What you'll discover will be wonderful. What you'll discover is yourself.,https://quotes.values.com/quote_artwork/7359/medium/20190321_thursday_quote.jpg?1552683072
"For what it’s worth: it’s never too late or, in my case, too early to be whoever you want to be.",https://quotes.values.com/quote_artwork/7885/medium/20190320_wednesday_quote_alternate2.jpg?1552689922
Twenty years from now you will be more disappointed by the things you didn't do than by the ones you did. So throw off the bowlines. Sail away from the safe harbor. Catch the trade winds in your sails. Explore. Dream. Discover.,https://quotes.values.com/quote_artwork/4171/medium/20190319_tuesday_quote.jpg?1552682997
Embrace uncertainty. Some of the most beautiful chapters in our lives won’t have a title until much later.,https://quotes.values.com/quote_artwork/7884/medium/20190318_monday_quote.jpg?1552682962
The most important thing in communication is to hear what isn't being said.,https://quotes.values.com/quote_artwork/6664/medium/20190315_friday_quote.jpg?1552095946
Deep listening is the kind of listening that can help relieve the suffering of another person... You listen with only one purpose: to help him or her to empty their heart.,https://quotes.values.com/quote_artwork/7883/medium/20190314_thursday_quote_updated.jpg?1552576582
There's a lot of difference between listening and hearing.,https://quotes.values.com/quote_artwork/7882/medium/20190313_wednesday_quote.jpg?1552095885
"Listening is a magnetic and strange thing, a creative force. The friends who listen to us are the ones we move toward. When we are listened to, it creates us, makes us unfold and expand.",https://quotes.values.com/quote_artwork/3817/medium/20190312_tuesday_quote.jpg?1552095841
The first duty of love is to listen.,https://quotes.values.com/quote_artwork/4151/medium/20190311_monday_quote.jpg?1552095812
"If human beings are perceived as potentials rather than problems, as possessing strengths instead of weaknesses, as unlimited rather than dull and unresponsive, then they thrive and grow to their capabilities.",https://quotes.values.com/quote_artwork/3180/medium/20190308_quote_fixed.jpg?1552091075
Find the good—and praise it.,https://quotes.values.com/quote_artwork/3546/medium/20190307_thursday_quote.jpg?1551560591
"I have yet to find a man or woman, however exalted their station, who did not do better work and put forth greater effort under a spirit of approval than under a spirit of criticism.",https://quotes.values.com/quote_artwork/6383/medium/20190306_wednesday_quote.jpg?1551560565
Promise yourself to be just as enthusiastic about the success of others as you are about your own.,https://quotes.values.com/quote_artwork/3710/medium/20190305_tuesday_quote.jpg?1551560543
"Be aware of what others are doing, applaud their efforts, acknowledge their successes, and encourage them in their pursuits. When we all help one another, everybody wins.",https://quotes.values.com/quote_artwork/4102/medium/20190304_monday_quote.jpg?1551560513
"Be happy in the moment, that’s enough. Each moment is all we need, not more.",https://quotes.values.com/quote_artwork/7453/medium/20190301_friday_quote.jpg?1550871772
The basic root of happiness lies in our minds; outer circumstances are nothing more than adverse or favorable.,https://quotes.values.com/quote_artwork/7880/medium/20190228_thursday_quote.jpg?1550871741
"The mind is just like a muscle—the more you exercise it, the stronger it gets and the more it can expand.",https://quotes.values.com/quote_artwork/7881/medium/20190227_wednesday_quote_alternate.jpg?1550985352
"In the end, just three things matter: How well we have lived. How well we have loved. How well we have learned to let go.",https://quotes.values.com/quote_artwork/7878/medium/20190226_tuesday_quote_alternate.jpg?1550878608
"The most precious gift we can offer others is our presence. When mindfulness embraces those we love, they will bloom like flowers.",https://quotes.values.com/quote_artwork/7877/medium/20190225_monday_quote.jpg?1550871649
"For a seed to achieve its greatest expression, it must come completely undone. The shell cracks, its insides come out and everything changes. To someone who doesn't understand growth, it would look like complete destruction.",https://quotes.values.com/quote_artwork/7876/medium/20190222_friday_quote.jpg?1550254774
,https://quotes.values.com/quote_artwork/7875/medium/20190221_thursday_quote.jpg?1550254755
Getting over a painful experience is much like crossing monkey bars. You have to let go at some point in order to move forward.,https://quotes.values.com/quote_artwork/6805/medium/20190220_wednesday_quote.jpg?1550254723
Turn your wounds into wisdom.,https://quotes.values.com/quote_artwork/7874/medium/20190219_tuesday_quote.jpg?1550254589
Every trial endured and weathered in the right spirit makes a soul nobler and stronger than it was before.,https://quotes.values.com/quote_artwork/4675/medium/20190218_monday_quote.jpg?1550254567
I think your whole life shows in your face and you should be proud of that.,https://quotes.values.com/quote_artwork/6943/medium/20190215_friday_quote.jpg?1549567453
"A person who has good thoughts cannot ever be ugly. You can have a wonky nose and a crooked mouth and a double chin and stick-out teeth, but if you have good thoughts they will shine out of your face like sunbeams and you will always look lovely.",https://quotes.values.com/quote_artwork/6872/medium/20190214_thursday_quote.jpg?1549567422
True beauty does not shine; it attracts.,https://quotes.values.com/quote_artwork/7873/medium/20190213_wednesday_quote.jpg?1549567389
To be beautiful means to be yourself. You don’t need to be accepted by others. You need to accept yourself.,https://quotes.values.com/quote_artwork/6807/medium/20190212_tuesday_quote.jpg?1549567366
True beauty is born through our actions and aspirations and in the kindness we offer to others.,https://quotes.values.com/quote_artwork/7872/medium/20190211_monday_quote_alternate2.jpg?1549646520
"I have a dream that my four children will one day live in a nation where they will not be judged by the color of their skin, but by the content of their character.",https://quotes.values.com/quote_artwork/7032/medium/20190208_friday_quote.jpg?1548806108
Every experience is a stitch in the fabric of your character.,https://quotes.values.com/quote_artwork/3230/medium/20190207_thursday_quote.jpg?1548806084
"The greatest discovery of our generation is that human beings can alter their lives by altering their attitudes of mind. As you think, so shall you be.",https://quotes.values.com/quote_artwork/6745/medium/20190206_wednesday_quote.jpg?1548806062
"Adversity does not build character, it reveals it.",https://quotes.values.com/quote_artwork/6514/medium/20190205_tuesday_quote.jpg?1548806040
"If I take care of my character, my reputation will take care of itself.",https://quotes.values.com/quote_artwork/7871/medium/20190204_monday_quote.jpg?1548963744
"I go to nature to be soothed and healed, and to have my senses put in order.",https://quotes.values.com/quote_artwork/7870/medium/20190201_friday_quote.jpg?1548455490
"And into the forest I go, to lose my mind and find my soul.",https://quotes.values.com/quote_artwork/7869/medium/20190131_thursday_quote.jpg?1548455385
Nature is not matter only. She is also spirit.,https://quotes.values.com/quote_artwork/7868/medium/20190130_wednesday_quote.jpg?1548455344
"I felt my lungs inflate with the onrush of scenery—air, mountains, trees, people. I thought, ‘This is what it is to be happy.",https://quotes.values.com/quote_artwork/7508/medium/20190129_tuesday_quote.jpg?1548455316
To walk into nature is to witness a thousand miracles.,https://quotes.values.com/quote_artwork/7867/medium/20190128_monday_quote.jpg?1548455282
"I speak not for myself but for those without voice… those who have fought for their rights… their right to live in peace, their right to be treated with dignity, their right to equality of opportunity, their right to be educated.",https://quotes.values.com/quote_artwork/7866/medium/20180125_friday_quote.jpg?1547859897
I would like to be known as a person who is concerned about freedom and equality and justice and prosperity for all people.,https://quotes.values.com/quote_artwork/7865/medium/20180124_thursday_quote.jpg?1547859876
"For to be free is not merely to cast off one's chains, but to live in a way that respects and enhances the freedom of others.",https://quotes.values.com/quote_artwork/7276/medium/20180123_wednesday_quote_alt_1.jpg?1548018262
"Honesty, equality, kindness, compassion, treating people the way you want to be treated and helping those in need. To me, those are traditional values.",https://quotes.values.com/quote_artwork/7668/medium/20180122_tuesday_quote_updated.jpg?1548013704
"Never, never be afraid to do what's right.",https://quotes.values.com/quote_artwork/6359/medium/20180121_monday_quote_updated.jpg?1548013486
"I learned that courage was not the absence of fear, but the triumph over it. The brave man is not he who does not feel afraid, but he who conquers that fear.",https://quotes.values.com/quote_artwork/7861/medium/20190114_monday_quote.jpg?1547244687
"It may take courage to embrace the possibilities of your own potential, but once you've flown past the summit of your fears, nothing will seem impossible.",https://quotes.values.com/quote_artwork/3805/medium/20190117_thursday_quote.jpg?1547244946
Be brave. Take risks. Nothing can substitute experience.,https://quotes.values.com/quote_artwork/7863/medium/20190116_wednesday_quote_updated.jpg?1547318598
"You can choose courage, or you can choose comfort, but you cannot choose both.",https://quotes.values.com/quote_artwork/7862/medium/20190115_tuesday_quote.jpg?1547244714
"I'm not afraid of storms, for I'm learning to sail my ship.",https://quotes.values.com/quote_artwork/3030/medium/20190118_friday_quote.jpg?1547244978
Laughter is the shortest distance between two people.,https://quotes.values.com/quote_artwork/3137/medium/20190111_friday_quote.jpg?1546641635
"At the height of laughter, the universe is flung into a kaleidoscope of new possibilities.",https://quotes.values.com/quote_artwork/5118/medium/20190110_thursday_quote.jpg?1546641613
"Laugh my friend, for laughter ignites a fire within the pit of your belly and awakens your being.",https://quotes.values.com/quote_artwork/7461/medium/20190109_wednesday_quote.jpg?1546641588
"Remember, laughter is 10 times more powerful than screams.",https://quotes.values.com/quote_artwork/7860/medium/20190108_tuesday_quote.jpg?1546641561
There is nothing in the world so irresistibly contagious as laughter and good humor.,https://quotes.values.com/quote_artwork/7859/medium/20190107_monday_quote.jpg?1546641535
The magic in new beginnings is truly the most powerful of them all.,https://quotes.values.com/quote_artwork/7857/medium/20190104_friday_quote.jpg?1546034366
"The secret of change is to focus all of your energy, not on fighting the old, but on building the new.",https://quotes.values.com/quote_artwork/7856/medium/20190103_thursday_quote.jpg?1546034335
I close my eyes to old ends. And open my heart to new beginnings.,https://quotes.values.com/quote_artwork/7855/medium/20190102_wednesday_quote.jpg?1546034298
What a wonderful thought it is that some of the best days of our lives haven't even happened yet.,https://quotes.values.com/quote_artwork/7858/medium/20190101_tuesday_quote_alternate.jpg?1546208533
The future belongs to those who believe in the beauty of their dreams.,https://quotes.values.com/quote_artwork/3998/medium/20181231_monday_quote_alternate.jpg?1546208733
"Love is not only something you feel, it is something you do.",https://quotes.values.com/quote_artwork/7682/medium/20181228_friday_quote.jpg?1545417482
Your circumstance doesn’t make life extraordinary. Love does.,https://quotes.values.com/quote_artwork/7593/medium/20181227_thursday_quote.jpg?1545417444
Let us see what love can do.,https://quotes.values.com/quote_artwork/6900/medium/20181226_wednesday_quote.jpg?1545417393
"And the Grinch, with his Grinch-feet ice cold in the snow, stood puzzling and puzzling, how could it be so? It came without ribbons. It came without tags. It came without packages, boxes or bags. And he puzzled and puzzled 'till his puzzler was sore. Then the Grinch thought of something he hadn't before.",https://quotes.values.com/quote_artwork/6909/medium/20181225_tuesday_quote.jpg?1545417358
The love in your heart wasn't put there to stay. Love isn't love 'til you give it away.,https://quotes.values.com/quote_artwork/3548/medium/20181224_monday_quote.jpg?1545417323
What greater thing is there for human souls than to feel that they are joined for life - to be with each other in silent unspeakable memories.,https://quotes.values.com/quote_artwork/4770/medium/20181221_friday_quote.jpg?1544814559
"My family is my life, and everything else comes second as far as what's important to me.",https://quotes.values.com/quote_artwork/7853/medium/20181220_thursday_quote.jpg?1545070947
"Having somewhere to go is home, having someone to love is family, having both is blessing.",https://quotes.values.com/quote_artwork/7183/medium/20181219_wednesday_quote.jpg?1544814499
"Family and friends are hidden treasures, seek them and enjoy their riches.",https://quotes.values.com/quote_artwork/7852/medium/20181218_tuesday_quote.jpg?1544814470
"The bond that links your true family is not one of blood, but of respect and joy in each other's life. Rarely do members of one family grow up under the same roof.",https://quotes.values.com/quote_artwork/7182/medium/20181217_monday_quote.jpg?1544814443
The best way to find yourself is to lose yourself in the service of others.,https://quotes.values.com/quote_artwork/7077/medium/20181214_friday_quote_alternate.jpg?1544207576
,https://quotes.values.com/quote_artwork/3685/medium/20181213_thursday_quote.jpg?1544207538
"Life is a gift, and it offers us the privilege, opportunity, and responsibility to give something back by becoming more.",https://quotes.values.com/quote_artwork/4540/medium/20181212_wednesday_quote.jpg?1544207503
We make a living by what we get. We make a life by what we give.,https://quotes.values.com/quote_artwork/7240/medium/20181211_tuesday_quote_alternate.jpg?1544207471
"At the end of the day, it's not about what you have or even what you've accomplished… It's about who you've lifted up, who you've made better. It's about what you've given back.",https://quotes.values.com/quote_artwork/7850/medium/20181210_monday_quote.jpg?1544207400
May you always be blessed with walls for the wind. A roof for the rain. A warm cup of tea by the fire. Laughter to cheer you. Those you love near you. And all that your heart might desire.,https://quotes.values.com/quote_artwork/6911/medium/20181207_friday_quote.jpg?1543624031
The unselfish effort to bring cheer to others will be the beginning of a happier life for ourselves.,https://quotes.values.com/quote_artwork/7849/medium/20181206_thursday_quote.jpg?1544114142
"I say to myself that I shall try to make my life like an open fireplace, so that people may be warmed and cheered by it and so go out themselves to warm and cheer.",https://quotes.values.com/quote_artwork/7848/medium/20181205_wednesday_quote.jpg?1543623930
"After every storm the sun will smile; for every problem there is a solution, and the soul's indefeasible duty is to be of good cheer.",https://quotes.values.com/quote_artwork/7847/medium/20181204_tuesday_quote_alternate_a.jpg?1543870010
"Carry good cheer in the morning;
Carry good cheer in the night.
Effort is sweeter and living completer,
If ever we walk in love's light.",https://quotes.values.com/quote_artwork/7846/medium/20181203_monday_quote.jpg?1543623604
"We cannot cure the world of sorrows, but we can choose to live in joy.",https://quotes.values.com/quote_artwork/7845/medium/20181130_friday_quote.jpg?1543112532
Joy; the kind of happiness that doesn’t depend on what happens.,https://quotes.values.com/quote_artwork/7844/medium/20181129_thursday_quote.jpg?1543112508
"Just follow your joy. Always. I think that if you do that, life will take you on the course that it’s meant to take you.",https://quotes.values.com/quote_artwork/7843/medium/20181128_wednesday_quote.jpg?1543112483
Joy is not in things; it is in us.,https://quotes.values.com/quote_artwork/7842/medium/20181127_tuesday_quote.jpg?1543112456
Joy is the holy fire that keeps our purpose warm and our intelligence aglow.,https://quotes.values.com/quote_artwork/7329/medium/20181126_monday_quote.jpg?1543112435
"When I started counting my blessings, my whole life turned around.",https://quotes.values.com/quote_artwork/4614/medium/20181123_friday_quote.jpg?1542394858
"As we express our gratitude, we must never forget that the highest appreciation is not to utter words, but to live by them.",https://quotes.values.com/quote_artwork/7426/medium/20181122_thursday_quote.jpg?1542394832
Feeling gratitude and not expressing it is like wrapping a present and not giving it.,https://quotes.values.com/quote_artwork/7841/medium/20181121_wednesday_quote.jpg?1542394789
At times our own light goes out and is rekindled by a spark from another person. Each of us has cause to think with deep gratitude of those who have lit the flame within us.,https://quotes.values.com/quote_artwork/4036/medium/20181120_tuesday_quote_updated.jpg?1542475130
"Be thankful for what you have; you'll end up having more. If you concentrate on what you don't have, you will never, ever have enough.",https://quotes.values.com/quote_artwork/7152/medium/20181119_monday_quote.jpg?1542394735
"Spirit is like the wind, in that we can’t see it but can see its effects, which are profound.",https://quotes.values.com/quote_artwork/6207/medium/20181115_friday_quote.jpg?1541813146
It is the soul's duty to be loyal to its own desires. It must abandon itself to its master passion.,https://quotes.values.com/quote_artwork/7419/medium/20181113_wednesday_quote.jpg?1541812821
A smile is a light in the window of the soul indicating that the heart is at home.,https://quotes.values.com/quote_artwork/4562/medium/20181114_thursday_quote.jpg?1541812982
"Each person has an ideal, a hope, a dream which represents the soul. We must give to it the warmth of love, the light of understanding and the essence of encouragement.",https://quotes.values.com/quote_artwork/6864/medium/20181113_tuesday_quote_alternate.jpg?1541950863
"Neither genius, fame, nor love show the greatness of the soul. Only kindness can do that.",https://quotes.values.com/quote_artwork/7840/medium/20181112_monday_quote_alternate.jpg?1541950843
"That’s what kindness is. It’s not doing something for someone else because they can’t, but because you can.",https://quotes.values.com/quote_artwork/7839/medium/20181109_friday_quote.jpg?1541304164
Kindness is a language which the deaf can hear and the blind can see.,https://quotes.values.com/quote_artwork/6856/medium/20181108_thursday_quote.jpg?1541304129
No act of kindness is too small. The gift of kindness may start as a small ripple that over time can turn into a tidal wave affecting the lives of many.,https://quotes.values.com/quote_artwork/6788/medium/20181107_wednesday_quote.jpg?1541304010
One kind word can warm three winter months.,https://quotes.values.com/quote_artwork/6345/medium/20181106_tuesday_quote.jpg?1541305903
"Unexpected kindness is the most powerful, least costly, and most underrated agent of human change.",https://quotes.values.com/quote_artwork/7838/medium/20181105_monday_quote.jpg?1541303820
"We cannot reach the goal by mere words alone. Without practice, nothing can be achieved.",https://quotes.values.com/quote_artwork/7837/medium/20101102_friday_quote.jpg?1540575958
"Do it again. Play it again. Sing it again. Read it again. Write it again. Sketch it again. Rehearse it again. Run it again. Try it again.
Because again is practice, and practice is improvement.",https://quotes.values.com/quote_artwork/7836/medium/20101101_thursday_quote.jpg?1540575930
It's not necessarily the amount of time you spend at practice that counts; it's what you put into the practice.,https://quotes.values.com/quote_artwork/7835/medium/20101031_wednesday_quote.jpg?1540575884
"Take chances, make mistakes. That's how you grow. Pain nourishes your courage. You have to fail in order to practice being brave.",https://quotes.values.com/quote_artwork/7834/medium/20101030_tuesday_quote_updated.jpg?1540576199
Practice is the best of all instructors.,https://quotes.values.com/quote_artwork/6797/medium/20101029_monday_quote_publilius_syrus2.jpg?1540999054
"We can each define ambition and progress for ourselves. The goal is to work toward a world where expectations are not set by the stereotypes that hold us back, but by our personal passion, talents and interests.",https://quotes.values.com/quote_artwork/7833/medium/20181026_friday_quote.jpg?1539992137
Don’t be afraid to be ambitious about your goals. Hard work never stops. Neither should your dreams.,https://quotes.values.com/quote_artwork/7832/medium/20181025_thursday_quote.jpg?1539972406
Ambition is a dream with a V8 engine.,https://quotes.values.com/quote_artwork/7831/medium/20181024_wednesday_quote.jpg?1539972371
"Life takes on meaning when you become motivated, set goals and charge after them in an unstoppable manner.",https://quotes.values.com/quote_artwork/7830/medium/20181023_tuesday_quote_updated.jpg?1539992203
Ambition is enthusiasm with a purpose.,https://quotes.values.com/quote_artwork/7829/medium/20181022_monday_quote.jpg?1539972309
"Although time seems to fly by, it never travels faster than one day at a time. Each day is a new opportunity to live your life to the fullest.",https://quotes.values.com/quote_artwork/7827/medium/20181019_friday_quote.jpg?1539379769
"The purpose of life is to live it, to taste experience to the utmost, to reach out eagerly and without fear for newer and richer experience.",https://quotes.values.com/quote_artwork/6706/medium/20181018_thursday_quote.jpg?1539379744
"Whatever you want to do, do it now! There are only so many tomorrows.",https://quotes.values.com/quote_artwork/7828/medium/20181017_wednesday_quote.jpg?1539379714
"Life is a great and wondrous mystery, and the only thing we know that we have for sure is what is right here right now. Don’t miss it.",https://quotes.values.com/quote_artwork/6223/medium/20181016_tuesday_quote.jpg?1539379683
"To be able to look back upon one's life in satisfaction, is to live twice.",https://quotes.values.com/quote_artwork/6244/medium/20181015_monday_quote.jpg?1539617389
Think left and think right and think low and think high.,https://quotes.values.com/quote_artwork/5633/medium/20181012_friday_quote.jpg?1538776493
The world needs dreamers and the world needs doers. But above all what the world needs most are dreamers that do.,https://quotes.values.com/quote_artwork/7826/medium/20181011_thursday_quote.jpg?1538776457
